{
 "schema": "drops/1",
 "id": "drops.global.fixture",
 "tables": [
  {
   "monster": "monster.global.fixture_rat",
   "crowns": {
    "min": 0,
    "max": 3
   },
   "entries": [
    {
     "item": "item.global.fixture_copper_ore",
     "chance": 1,
     "qty_min": 1,
     "qty_max": 2
    },
    {
     "item": "item.global.fixture_brass_ingot",
     "chance": 0.01,
     "qty_min": 1,
     "qty_max": 1
    }
   ],
   "first_kill": []
  },
  {
   "monster": "monster.global.fixture_jaw",
   "crowns": {
    "min": 40,
    "max": 40
   },
   "entries": [],
   "first_kill": [
    "item.global.fixture_brass_ingot"
   ]
  }
 ],
 "zone_pity": [
  {
   "item": "item.global.fixture_brass_ingot",
   "kills": 200
  }
 ]
}
