{
 "schema": "drops/1",
 "id": "drops.thunderhead.fixture",
 "tables": [
  {
   "monster": "monster.thunderhead.fixture_rat",
   "crowns": {
    "min": 1,
    "max": 2
   },
   "entries": [
    {
     "item": "item.global.fixture_copper_ore",
     "chance": 0.5,
     "qty_min": 1,
     "qty_max": 1
    }
   ],
   "first_kill": []
  },
  {
   "monster": "monster.thunderhead.fixture_rat_king",
   "crowns": {
    "min": 9,
    "max": 9
   },
   "entries": [],
   "first_kill": [
    "item.global.fixture_brass_ingot"
   ]
  }
 ],
 "zone_pity": [
  {
   "item": "item.global.fixture_copper_ore",
   "kills": 10
  }
 ]
}
